"DESCRIPTION","DURATION IN MS","NAME","PARENT SUITE","START TIME","STATUS","STOP TIME","SUB SUITE","SUITE","TEST CLASS","TEST METHOD"
"","3235","Verify if the user is able to data based on partial name of author","tests","Fri Mar 07 21:28:58 GMT+04:00 2025","passed","Fri Mar 07 21:29:01 GMT+04:00 2025","","author_test","",""
"","327","Verify if the user is gets 404 when searching for non-existent author","tests","Fri Mar 07 21:29:02 GMT+04:00 2025","failed","Fri Mar 07 21:29:02 GMT+04:00 2025","","author_test","",""
"","1177","Verify if the user is able to data based on partial name of title","tests","Fri Mar 07 21:29:05 GMT+04:00 2025","passed","Fri Mar 07 21:29:06 GMT+04:00 2025","","title_test","",""
"","669","Verify if get all author response returns 200 with valid schema","tests","Fri Mar 07 21:29:02 GMT+04:00 2025","passed","Fri Mar 07 21:29:03 GMT+04:00 2025","","author_test","",""
"","335","Verify if the user is gets 405 when searching for non-existent title","tests","Fri Mar 07 21:29:07 GMT+04:00 2025","failed","Fri Mar 07 21:29:07 GMT+04:00 2025","","title_test","",""
"","1178","Verify if the user is not able to data based on partial name of title with exact match","tests","Fri Mar 07 21:29:06 GMT+04:00 2025","failed","Fri Mar 07 21:29:07 GMT+04:00 2025","","title_test","",""
"","833","Verify if the user is not able to data based on partial name of title with exact match","tests","Fri Mar 07 21:29:01 GMT+04:00 2025","failed","Fri Mar 07 21:29:02 GMT+04:00 2025","","author_test","",""
"","1628","Verify if get all title response returns 200 with valid schema","tests","Fri Mar 07 21:29:03 GMT+04:00 2025","passed","Fri Mar 07 21:29:05 GMT+04:00 2025","","title_test","",""
